{
  "schema_version": "1.0",
  "contribution_type": "engineering_experience",
  "title": "UART异常长度导致接收状态机失步的定位与修复",
  "summary": "外部长度字段未经边界约束进入接收计数，异常输入可能使协议状态机失步。",
  "domain": ["embedded", "UART", "protocol"],
  "problem_context": "嵌入式串口协议接收状态机。",
  "problem_description": "异常长度字段可直接控制后续接收计数，缺少与实际缓冲区容量的一致性检查。",
  "symptom": "异常帧后后续合法帧可能无法正常解析。",
  "trigger_conditions": ["收到合法帧头", "长度字段超过允许范围"],
  "investigation_process": ["先排查CRC路径，确认错误帧能够正常丢弃", "追踪长度字段到接收计数，发现生效前缺少上限检查"],
  "root_cause": {"status": "confirmed", "description": "外部长度字段参与接收计数前未进行上限校验。", "evidence": ["代码路径追踪", "边界值注入"]},
  "solution": "长度字段生效前做合法范围校验，非法帧立即丢弃并复位状态机。",
  "code_or_parameter_changes": ["增加长度上下限检查"],
  "verification": {"status": "passed", "method": "注入边界长度后继续发送合法帧", "result": "非法长度被丢弃且后续协议恢复"},
  "benefit": "降低协议失步和潜在缓冲区越界风险。",
  "lessons_learned": ["所有外部可控长度字段在参与数组、DMA或状态机计数前都应先约束。"],
  "applicable_scope": ["带外部长度字段的嵌入式通信协议"],
  "source": {"repository": "example/repo", "branch": "main", "commit": "abcdef0", "files": ["src/uart.c"]},
  "evidence_items": ["修复前后diff", "边界值测试"],
  "contributor": {"username": "example-user", "display_name": "Example User", "github_username": "example-user"},
  "submission_preferences": {"visibility": "public", "attribution": "username", "allow_repository_name": true, "allow_commit_id": true, "allow_file_paths": true, "allow_code_excerpt": false, "rights_confirmed": true},
  "privacy": {"contains_private_code": false, "sanitized": true, "notes": "示例数据"}
}
